audio_file,tempo,transcricao
/workspace/data/synthesized_audio/Q362.wav,0.567255973815918,can you show me the control bar for playing music
/workspace/data/synthesized_audio/Q203.wav,0.5381526947021484,how do i set clear dialogue
/workspace/data/synthesized_audio/Q429.wav,0.8030927181243896,why should you read the safety instructions before using the tv
/workspace/data/synthesized_audio/Q267.wav,0.8187565803527832,how can i rent or buy a movie or tv show in google tv app
/workspace/data/synthesized_audio/Q019.wav,0.6524937152862549,how to open the list of installed applications
/workspace/data/synthesized_audio/Q200.wav,0.7864882946014404,how do i select a sound style
/workspace/data/synthesized_audio/Q011.wav,0.8244810104370117,what dimensions should i consider when buying the wall mount
/workspace/data/synthesized_audio/Q153.wav,0.6880686283111572,how can i view photos stored on digital photo camera
/workspace/data/synthesized_audio/Q385.wav,0.4828364849090576,what are the sound specs
/workspace/data/synthesized_audio/Q106.wav,0.6037735939025879,what can you tell me about in tennaport
/workspace/data/synthesized_audio/Q372.wav,0.5087292194366455,how do i open netflix
/workspace/data/synthesized_audio/Q166.wav,0.597597599029541,how do i start the internet browser
/workspace/data/synthesized_audio/Q255.wav,0.7080888748168945,how to set up philip's wireless home speakers with ambalite
/workspace/data/synthesized_audio/Q178.wav,0.5882017612457275,how do i set dark details gamma
/workspace/data/synthesized_audio/Q047.wav,0.6163601875305176,how can i switch the t v on
/workspace/data/synthesized_audio/Q152.wav,1.0604307651519775,how can i have more information in watching or playing content from a u s b storage device
/workspace/data/synthesized_audio/Q029.wav,0.6164708137512207,how to open direct selection of options
/workspace/data/synthesized_audio/Q010.wav,0.8488941192626953,how to find assembly instructions of the t v stand
/workspace/data/synthesized_audio/Q114.wav,1.0864355564117432,how can i operate h dmi cc compatible devices with t v remote control
/workspace/data/synthesized_audio/Q181.wav,0.5479028224945068,how to set up h d r tone mapping
/workspace/data/synthesized_audio/Q036.wav,0.6817500591278076,how to insert digital subchannels
/workspace/data/synthesized_audio/Q099.wav,0.6443979740142822,how can i open the t v guide
/workspace/data/synthesized_audio/Q309.wav,0.578606367111206,how can i check how much storage is being used
/workspace/data/synthesized_audio/Q032.wav,0.49782848358154297,how to use the playback buttons
/workspace/data/synthesized_audio/Q398.wav,0.6693994998931885,what can i do if the stand by light keeps blinking
/workspace/data/synthesized_audio/Q286.wav,0.5119180679321289,how can i turn on text to speech
/workspace/data/synthesized_audio/Q052.wav,0.8025314807891846,how can i open the basic menu without the remote control
/workspace/data/synthesized_audio/Q008.wav,0.614560604095459,how do i open the home screen and open an item
/workspace/data/synthesized_audio/Q306.wav,0.6335189342498779,how can i use the twenty four hour format
/workspace/data/synthesized_audio/Q390.wav,1.0237541198730469,how can i use more help functions to diagnose issues and get more information about the t v
/workspace/data/synthesized_audio/Q205.wav,0.6279683113098145,how do i set up custom a i equalizer
/workspace/data/synthesized_audio/Q196.wav,0.5693325996398926,how to set up motion blur reduction
/workspace/data/synthesized_audio/Q257.wav,0.838221549987793,how do i set up my phillips wireless home speakers to work with ambalite
/workspace/data/synthesized_audio/Q077.wav,0.5145738124847412,how can i set the content rating
/workspace/data/synthesized_audio/Q413.wav,0.9707577228546143,what can i do if h d m i e a r c is not working properly
/workspace/data/synthesized_audio/Q334.wav,0.835874080657959,how can i view the bluetooth registered device information
/workspace/data/synthesized_audio/Q230.wav,0.5308089256286621,how do i set up audio output
/workspace/data/synthesized_audio/Q023.wav,0.7644045352935791,how do i open the channel list while watching t v
/workspace/data/synthesized_audio/Q351.wav,0.576134204864502,how can i open the photo folder
/workspace/data/synthesized_audio/Q445.wav,0.6638236045837402,what is a m d freeasinc premium
/workspace/data/synthesized_audio/Q359.wav,0.6959202289581299,what can you tell me about browsing three hundred sixty photo files
/workspace/data/synthesized_audio/Q227.wav,0.7689113616943359,question how do i set up auto volume
/workspace/data/synthesized_audio/Q110.wav,0.6506490707397461,what can you tell me about h d m i arc and e a r c
/workspace/data/synthesized_audio/Q421.wav,0.6454854011535645,what can i do if i'm unable to pair
/workspace/data/synthesized_audio/Q222.wav,0.729414701461792,how do i set up d r c dynamic range control
/workspace/data/synthesized_audio/Q226.wav,0.639702558517456,how to set up room calibration
/workspace/data/synthesized_audio/Q248.wav,0.5590581893920898,how do i set up lounge light mode
/workspace/data/synthesized_audio/Q214.wav,0.6837894916534424,question how do i set up mimi sound personalization
/workspace/data/synthesized_audio/Q187.wav,0.5177114009857178,how to set wide color gamut
/workspace/data/synthesized_audio/Q046.wav,0.6175763607025146,how do i clean the remote control
/workspace/data/synthesized_audio/Q442.wav,0.4578995704650879,what is google t v
/workspace/data/synthesized_audio/Q250.wav,0.5227892398834229,how do i set ambellite brightness
/workspace/data/synthesized_audio/Q256.wav,0.8760488033294678,how do i turn on off phillip's wireless home speakers that work with ambalite
/workspace/data/synthesized_audio/Q301.wav,0.588543176651001,how can assess date and time setting
/workspace/data/synthesized_audio/Q314.wav,0.5046365261077881,preset time
/workspace/data/synthesized_audio/Q013.wav,0.7050387859344482,how do i insert the power cable into the power connector
/workspace/data/synthesized_audio/Q311.wav,0.5578243732452393,how can i set the power on behavior
/workspace/data/synthesized_audio/Q216.wav,0.96781325340271,how do i control the sound settings of my h dmi sound system via easylink too
/workspace/data/synthesized_audio/Q324.wav,0.8887448310852051,how can i adjust picture and audio in retail mode settings
/workspace/data/synthesized_audio/Q009.wav,0.5912396907806396,how do i find the safety instructions
/workspace/data/synthesized_audio/Q405.wav,0.7648837566375732,what can i do if the picture settings change after a while
/workspace/data/synthesized_audio/Q363.wav,0.5915923118591309,what can you tell me about browsing music files
/workspace/data/synthesized_audio/Q426.wav,0.7578926086425781,what should i do to troubleshoot any problems with a phillips te v
/workspace/data/synthesized_audio/Q061.wav,0.6222047805786133,what are the conditions for the channel lis copy
/workspace/data/synthesized_audio/Q199.wav,0.6703763008117676,how do i format the picture manually
/workspace/data/synthesized_audio/Q249.wav,0.739687442779541,how do i set the duration in minutes of the lounge light mode
/workspace/data/synthesized_audio/Q072.wav,0.5424730777740479,how to unlock a channel
/workspace/data/synthesized_audio/Q284.wav,0.6092450618743896,how can i switch on accessibility
/workspace/data/synthesized_audio/Q270.wav,0.6092832088470459,what you can tell me about youtube music app
/workspace/data/synthesized_audio/Q177.wav,0.452073335647583,how to set video level
/workspace/data/synthesized_audio/Q172.wav,0.5933165550231934,how to set automatic picture and movie style
/workspace/data/synthesized_audio/Q192.wav,0.5271072387695312,how do i set up noise reduction
/workspace/data/synthesized_audio/Q117.wav,0.5055160522460938,could you tell me more about eesellik
/workspace/data/synthesized_audio/Q264.wav,0.4848041534423828,what you can tell me about apps
/workspace/data/synthesized_audio/Q415.wav,0.7032113075256348,what can i do if u s b file playback is choppy
/workspace/data/synthesized_audio/Q224.wav,0.5105428695678711,how do i set up sound stage
/workspace/data/synthesized_audio/Q221.wav,0.46678733825683594,how do i set up surround sound
/workspace/data/synthesized_audio/Q005.wav,0.5569913387298584,how to do a search on google tv
/workspace/data/synthesized_audio/Q140.wav,0.5408213138580322,how can i adjust the volume in headphones
/workspace/data/synthesized_audio/Q313.wav,0.6252360343933105,how can i set the screen off to save energy consumption
/workspace/data/synthesized_audio/Q364.wav,0.5257267951965332,how can i playing music files
/workspace/data/synthesized_audio/Q316.wav,0.5549666881561279,what i need to use google cast
/workspace/data/synthesized_audio/Q308.wav,0.6883611679077148,how can i set the keyboard layout for u s b keyboard
/workspace/data/synthesized_audio/Q418.wav,0.6752939224243164,what can i do if the p c and internet connection are slow
/workspace/data/synthesized_audio/Q190.wav,0.6834127902984619,how does thatt sharpness
/workspace/data/synthesized_audio/Q409.wav,0.8019745349884033,what can i do if the computer picture is not stable
/workspace/data/synthesized_audio/Q403.wav,0.6676232814788818,what can i do about poor antenna reception
/workspace/data/synthesized_audio/Q252.wav,0.5286421775817871,how do i set ambolite wall color
/workspace/data/synthesized_audio/Q298.wav,0.6903438568115234,does this television contain open source software
/workspace/data/synthesized_audio/Q094.wav,0.5713651180267334,how can i create a list of favorite channels
/workspace/data/synthesized_audio/Q305.wav,0.5102481842041016,how can i set the time zone
/workspace/data/synthesized_audio/Q071.wav,0.5860180854797363,how to lock a channel
/workspace/data/synthesized_audio/Q223.wav,0.45205068588256836,how do i set up height speakers
/workspace/data/synthesized_audio/Q109.wav,0.5545589923858643,what can you tell me about copy protection
/workspace/data/synthesized_audio/Q057.wav,0.6809401512145996,how can i start a manual channel update on my t v
/workspace/data/synthesized_audio/Q356.wav,0.6520378589630127,how can i open three hundred sixty photo's folder
/workspace/data/synthesized_audio/Q251.wav,0.5888082981109619,how do i set ambolite saturation
/workspace/data/synthesized_audio/Q437.wav,0.5496420860290527,transportation in low temperatures
/workspace/data/synthesized_audio/Q297.wav,0.6179196834564209,how can i display t v status information
/workspace/data/synthesized_audio/Q337.wav,0.7537596225738525,how can i update the remote control software
/workspace/data/synthesized_audio/Q107.wav,0.5221362113952637,what can you tell me about h d m i quality
/workspace/data/synthesized_audio/Q089.wav,0.5513269901275635,how can i find service navigation
/workspace/data/synthesized_audio/Q164.wav,0.5832631587982178,how to configure network and internet
/workspace/data/synthesized_audio/Q354.wav,0.7431924343109131,what can you tell me about browsing photo files
/workspace/data/synthesized_audio/Q217.wav,0.6114320755004883,how do i set the sound style
/workspace/data/synthesized_audio/Q449.wav,0.5589005947113037,what is the copyright of the wi fi alliance
/workspace/data/synthesized_audio/Q318.wav,0.5663473606109619,how can i cast an app to the tv screen
/workspace/data/synthesized_audio/Q304.wav,0.49822020530700684,how can i set the time
/workspace/data/synthesized_audio/Q119.wav,0.7928054332733154,how can i set the signal quality for each h dmi connector
/workspace/data/synthesized_audio/Q122.wav,0.523564338684082,ultra h d options
/workspace/data/synthesized_audio/Q319.wav,0.6339890956878662,how can i enable or disable the system's sounds
/workspace/data/synthesized_audio/Q236.wav,0.5575459003448486,how do i turn on ambalite
/workspace/data/synthesized_audio/Q066.wav,0.6750526428222656,how to upload channel list to installed t v s
/workspace/data/synthesized_audio/Q348.wav,0.6051111221313477,can you show me the control bar to play videos
/workspace/data/synthesized_audio/Q210.wav,0.7329940795898438,how do i set up a d t s playfy compatible device
/workspace/data/synthesized_audio/Q127.wav,0.6352219581604004,what can you tell me about h d r ten plus or dolby
/workspace/data/synthesized_audio/Q049.wav,0.5849442481994629,how i can switch the t v to standby
/workspace/data/synthesized_audio/Q215.wav,0.8231546878814697,how do i test my hearing and set up my hearing profile
/workspace/data/synthesized_audio/Q353.wav,0.524266242980957,can you show me the control bar to play videos
/workspace/data/synthesized_audio/Q014.wav,0.6536352634429932,how to insert the antenna plug into the antenna socket
/workspace/data/synthesized_audio/Q388.wav,0.49980807304382324,how can i open help
/workspace/data/synthesized_audio/Q175.wav,0.559729814529419,how do i set the back like contrast
/workspace/data/synthesized_audio/Q368.wav,0.9401576519012451,how do i start a game on a game console or computer for the first time
/workspace/data/synthesized_audio/Q320.wav,0.7512164115905762,how can i set a new code or reset the change code for child lock
/workspace/data/synthesized_audio/Q366.wav,0.7093355655670166,how do i install games from the play store
/workspace/data/synthesized_audio/Q340.wav,0.9439613819122314,how can i add a folder or a file to the favorite's menu
/workspace/data/synthesized_audio/Q229.wav,0.7505769729614258,how do i set up dolby atmo's notification
/workspace/data/synthesized_audio/Q064.wav,0.5893945693969727,how can i check the current version of the channel list
/workspace/data/synthesized_audio/Q111.wav,0.6137416362762451,what can you tell me about h d m i e a r c
/workspace/data/synthesized_audio/Q160.wav,0.771735668182373,do you have any notes for a m d graphics card users
/workspace/data/synthesized_audio/Q161.wav,0.6815967559814453,how do i connect my t v to the internet wirelessly
/workspace/data/synthesized_audio/Q081.wav,0.46180200576782227,what is audio language
/workspace/data/synthesized_audio/Q121.wav,0.8153836727142334,what is the maximum allowed in the setting standardt to ultra h d
/workspace/data/synthesized_audio/Q219.wav,0.6446578502655029,how do i adjust the treble level
/workspace/data/synthesized_audio/Q044.wav,0.8902640342712402,how do i use a remote control that uses i r infrared
/workspace/data/synthesized_audio/Q084.wav,0.7191133499145508,how can i set the mixed volume in audio description
/workspace/data/synthesized_audio/Q246.wav,0.6312317848205566,how do i set the ambisleap color
/workspace/data/synthesized_audio/Q209.wav,0.5946228504180908,how do i stream audio wirelessly to my speakers
/workspace/data/synthesized_audio/Q128.wav,0.7008790969848633,premium ge sync games for supported tv models
/workspace/data/synthesized_audio/Q344.wav,1.3446028232574463,how could i view my photos or play music and videos from a connected u s b flash drive or u s b hard drive
/workspace/data/synthesized_audio/Q440.wav,0.6036899089813232,what are the terms of use t v
/workspace/data/synthesized_audio/Q191.wav,0.4836862087249756,how do i set up texture enhancement
/workspace/data/synthesized_audio/Q258.wav,1.229029655456543,how do i view the current configuration of phillips wireless home speakers with ambalite network and speaker l e ds
/workspace/data/synthesized_audio/Q120.wav,1.0151705741882324,what is the maximum allowed in the setting optimal to ultra h d
/workspace/data/synthesized_audio/Q159.wav,0.8230469226837158,do you have any notes for nvidia graphics card users
/workspace/data/synthesized_audio/Q237.wav,0.563295841217041,how do i follow video
/workspace/data/synthesized_audio/Q451.wav,0.527780294418335,what are the copyrights of other trade mararks
/workspace/data/synthesized_audio/Q416.wav,0.9845960140228271,what can i do if the wi fi network not found or distorted
/workspace/data/synthesized_audio/Q431.wav,0.778315544128418,what is the risk of injury or damage to the t v
/workspace/data/synthesized_audio/Q142.wav,0.6787552833557129,how can i connect a u s b keyboard
/workspace/data/synthesized_audio/Q033.wav,0.5527119636535645,how do i open or close the t v guide
/workspace/data/synthesized_audio/Q254.wav,0.563431978225708,how do i adjust ambellites warm white
/workspace/data/synthesized_audio/Q129.wav,0.9606280326843262,how to connect home theater system with hdmirc e a r c
/workspace/data/synthesized_audio/Q317.wav,0.6261301040649414,what can you tell me about apps with google cast
/workspace/data/synthesized_audio/Q054.wav,0.643791675567627,how can i change channels without the remote control
/workspace/data/synthesized_audio/Q401.wav,1.0082299709320068,what can i do if there's no picture or if the picture is distorted
/workspace/data/synthesized_audio/Q425.wav,0.8294775485992432,how can i change the language back to language in basic mode
/workspace/data/synthesized_audio/Q241.wav,0.42792439460754395,how to follow app
/workspace/data/synthesized_audio/Q133.wav,0.5860130786895752,what can i do if sound with loud noise
/workspace/data/synthesized_audio/Q063.wav,0.5487551689147949,how can i copy a channel list
/workspace/data/synthesized_audio/Q360.wav,0.5370321273803711,how can i open music folder
/workspace/data/synthesized_audio/Q149.wav,0.6401777267456055,how can i stop watching the u s b storage content
/workspace/data/synthesized_audio/Q087.wav,0.8703000545501709,how can i set the dialogue enhancement in universal enhancement
/workspace/data/synthesized_audio/Q396.wav,1.2052161693572998,what can i do if the t v makes a creaking sound at start up or when switching off
/workspace/data/synthesized_audio/Q136.wav,0.612431526184082,what can you tell me about digital audio out optical
/workspace/data/synthesized_audio/Q341.wav,0.5234520435333252,how can i view favorite files
/workspace/data/synthesized_audio/Q098.wav,0.5255403518676758,tell me what is t v guide data
/workspace/data/synthesized_audio/Q346.wav,0.5196962356567383,how can i open video folder
/workspace/data/synthesized_audio/Q412.wav,0.6730818748474121,what can i do if h d m i ezlink is not working
/workspace/data/synthesized_audio/Q276.wav,0.8233506679534912,what you can tell me about google play store and what is need to use
/workspace/data/synthesized_audio/Q220.wav,0.7481613159179688,how do i customize the equalizer
/workspace/data/synthesized_audio/Q059.wav,1.1582248210906982,what should i select after accessing the antenna cable installation option
/workspace/data/synthesized_audio/Q043.wav,0.5671141147613525,how do i perform a voice search
/workspace/data/synthesized_audio/Q183.wav,0.5591380596160889,how to set color
/workspace/data/synthesized_audio/Q086.wav,0.5783374309539795,how can i select speech in audio description
/workspace/data/synthesized_audio/Q168.wav,0.6523933410644531,how to access the quick menu and tv settings
/workspace/data/synthesized_audio/Q076.wav,0.6039257049560547,how can i switch off the parental age rating
/workspace/data/synthesized_audio/Q373.wav,0.7137043476104736,what can you tell me about alexa
/workspace/data/synthesized_audio/Q441.wav,0.5460608005523682,what are the terms of use smart t v
/workspace/data/synthesized_audio/Q330.wav,0.7740433216094971,how can i connect or disconnect a bluetooth registered device
/workspace/data/synthesized_audio/Q408.wav,0.629065752029419,what can i do if the picture position is incorrect
/workspace/data/synthesized_audio/Q365.wav,0.6031601428985596,how do i download the phillips t v remote app
/workspace/data/synthesized_audio/Q419.wav,0.5725007057189941,what can i do if the connection fails
/workspace/data/synthesized_audio/Q381.wav,0.5738229751586914,what is the specification of the screen type
/workspace/data/synthesized_audio/Q378.wav,0.7856695652008057,what are the specifications for turning on the product
/workspace/data/synthesized_audio/Q146.wav,1.0821716785430908,what can you tell me about special keys for apps and internet pages
/workspace/data/synthesized_audio/Q279.wav,0.6171367168426514,what to do if google play store is not in the appse row
/workspace/data/synthesized_audio/Q435.wav,0.5791659355163574,what about lightning storms
/workspace/data/synthesized_audio/Q235.wav,0.7255666255950928,how do i set the digital output offset
/workspace/data/synthesized_audio/Q322.wav,1.1517572402954102,how can i select the location on the tv in retail mode settings
/workspace/data/synthesized_audio/Q329.wav,0.7806746959686279,how can i pair a bluetooth registered device with the t v
/workspace/data/synthesized_audio/Q144.wav,0.4888322353363037,how can i change the keyboard layout
/workspace/data/synthesized_audio/Q338.wav,1.3317999839782715,how could i view my photos or play my music and videos from a computer or a n a s network attached storage on my home network
/workspace/data/synthesized_audio/Q097.wav,0.5219120979309082,how can i remove a favurite's list
/workspace/data/synthesized_audio/Q303.wav,0.4624004364013672,how can i set the date
/workspace/data/synthesized_audio/Q186.wav,0.516465425491333,how to set up color enhancement
/workspace/data/synthesized_audio/Q080.wav,0.5534489154815674,how can i switch to manno or stereo
/workspace/data/synthesized_audio/Q347.wav,0.43700146675109863,how can i play a video
/workspace/data/synthesized_audio/Q003.wav,0.9712786674499512,how to get personalized recommendations of streaming services
/workspace/data/synthesized_audio/Q015.wav,0.5431191921234131,how to get an overview of the keys top
/workspace/data/synthesized_audio/Q374.wav,0.6168725490570068,what is needed to control the t v with alexa
/workspace/data/synthesized_audio/Q447.wav,0.686586856842041,what is the copyright of d t s x
/workspace/data/synthesized_audio/Q067.wav,0.4906728267669678,how can i tune to a channel
/workspace/data/synthesized_audio/Q387.wav,0.7982273101806641,how can i register the t v to enjoy a range of benefits
/workspace/data/synthesized_audio/Q243.wav,0.6092982292175293,how do i start amberleep
/workspace/data/synthesized_audio/Q339.wav,0.7125425338745117,how can i browse and play the files on computer
/workspace/data/synthesized_audio/Q349.wav,0.8447439670562744,what can you tell me about browsing video files
/workspace/data/synthesized_audio/Q397.wav,0.9892687797546387,what can i do if the t v doesn't respond to the remote control
/workspace/data/synthesized_audio/Q108.wav,0.8944199085235596,what to do if a device connected with h dmi is not working
/workspace/data/synthesized_audio/Q038.wav,0.6270971298217773,how do i mute or restore sound
/workspace/data/synthesized_audio/Q056.wav,0.7384936809539795,how can i access demo to start a demo movie
/workspace/data/synthesized_audio/Q195.wav,0.500067949295044,how do i set smoothness
/workspace/data/synthesized_audio/Q420.wav,0.7113966941833496,what can i do if streaming video quality is poor
/workspace/data/synthesized_audio/Q115.wav,0.9270210266113281,how can i power off h dmi i devices with the t v
/workspace/data/synthesized_audio/Q078.wav,0.5342113971710205,how can i open the channel options
/workspace/data/synthesized_audio/Q180.wav,0.9263143539428711,how do i set contrast enhancement dynamic enhancement level
/workspace/data/synthesized_audio/Q375.wav,0.6562185287475586,what can you tell me about alexis gills
/workspace/data/synthesized_audio/Q025.wav,0.5941498279571533,how do i return to the previous menu
/workspace/data/synthesized_audio/Q184.wav,0.5704126358032227,how to set saturation
/workspace/data/synthesized_audio/Q173.wav,1.2290821075439453,how do i turn on and off the automatic picture in movie style setting
/workspace/data/synthesized_audio/Q028.wav,0.5748226642608643,how to open the help option
/workspace/data/synthesized_audio/Q213.wav,0.9904756546020508,how do i set up my home theater system with my t v and playf t v speakers
/workspace/data/synthesized_audio/Q169.wav,0.5831801891326904,how do i set the t v image
/workspace/data/synthesized_audio/Q017.wav,0.5184242725372314,how do i start the netflixap
/workspace/data/synthesized_audio/Q262.wav,0.44899511337280273,how to start the aurora app
/workspace/data/synthesized_audio/Q041.wav,0.7394580841064453,how do i check the software information of the remote control
/workspace/data/synthesized_audio/Q281.wav,0.6386754512786865,how can i add a credit card on google play on tv
/workspace/data/synthesized_audio/Q124.wav,0.5727455615997314,what happens if i set optimal auto game
/workspace/data/synthesized_audio/Q287.wav,0.5632922649383545,how can i turn on accessibility short cut
/workspace/data/synthesized_audio/Q211.wav,1.1097102165222168,how do i set up a wireless d t s play fii surround compatible device
/workspace/data/synthesized_audio/Q352.wav,0.4454915523529053,how can i view a photo
/workspace/data/synthesized_audio/Q158.wav,0.5466177463531494,how can i connect a computer to the t v
/workspace/data/synthesized_audio/Q370.wav,0.49834537506103516,how do i set up the settings bar
/workspace/data/synthesized_audio/Q395.wav,0.5771703720092773,what can i do if the t v does not turn on
/workspace/data/synthesized_audio/Q096.wav,0.502680778503418,how can i rename a favorite's list
/workspace/data/synthesized_audio/Q438.wav,0.9721240997314453,what should i do if my t v has moisture levels on the front
/workspace/data/synthesized_audio/Q328.wav,0.5703394412994385,what you can tell about perir accessory
/workspace/data/synthesized_audio/Q253.wav,0.601116418838501,how do i set ambalite to turn off immediately
/workspace/data/synthesized_audio/Q290.wav,0.5165567398071289,how can i software update by myself
/workspace/data/synthesized_audio/Q093.wav,0.5906338691711426,how can i select a channel from the favorite's list
/workspace/data/synthesized_audio/Q268.wav,1.1365652084350586,how can i watch a rented or purchased movie or tv show in google t v app
/workspace/data/synthesized_audio/Q443.wav,1.1695756912231445,what are the terms h d m i and h dmi i by definition multimedia interface
/workspace/data/synthesized_audio/Q452.wav,0.5435330867767334,about services offered by third parties
