audio_file,tempo,transcricao
/workspace/data/synthesized_audio/Q362.wav,0.16138648986816406,can you show me the control bar for playing music
/workspace/data/synthesized_audio/Q203.wav,0.2285780906677246,how do i set clear dialogue
/workspace/data/synthesized_audio/Q429.wav,0.13915801048278809,why should you read the safy instructions before using the ti
/workspace/data/synthesized_audio/Q267.wav,0.14595937728881836,how can i rent or buy a movie or t v show in gugle ti vi aap
/workspace/data/synthesized_audio/Q019.wav,0.14090919494628906,how to open the list of installed applications
/workspace/data/synthesized_audio/Q200.wav,0.17629575729370117,how do i select a sound style
/workspace/data/synthesized_audio/Q011.wav,0.1844923496246338,what dimensions should i consider when buying the wall mount
/workspace/data/synthesized_audio/Q153.wav,0.1649329662322998,how can i view photos storeddigital photo camera
/workspace/data/synthesized_audio/Q385.wav,0.17336392402648926,what are the sound specks
/workspace/data/synthesized_audio/Q106.wav,0.16461730003356934,what can you tell me about in tenna port
/workspace/data/synthesized_audio/Q372.wav,0.20468807220458984,how do i open nat fleicks
/workspace/data/synthesized_audio/Q166.wav,0.1136317253112793,how do i start the inner net brrusr
/workspace/data/synthesized_audio/Q255.wav,0.13457202911376953,how to set up philip ' s wireless home speakers with ambulite
/workspace/data/synthesized_audio/Q178.wav,0.1624596118927002,how do i set dark details gama
/workspace/data/synthesized_audio/Q047.wav,0.17374515533447266,how can i switch the tea vion
/workspace/data/synthesized_audio/Q152.wav,0.1908886432647705,how can i have more information in watching or playing content from a u s b storage device
/workspace/data/synthesized_audio/Q029.wav,0.2922699451446533,how to open direct selection of options
/workspace/data/synthesized_audio/Q010.wav,0.18065309524536133,how to find asmbly instructions of the ti stand
/workspace/data/synthesized_audio/Q114.wav,0.20679974555969238,how can i operate h d a i c c compatible devices with t v remote control
/workspace/data/synthesized_audio/Q181.wav,0.14215779304504395,how to set up ea d oar tone mapping
/workspace/data/synthesized_audio/Q036.wav,0.17317676544189453,how to inrt digital sub channels
/workspace/data/synthesized_audio/Q099.wav,0.1560530662536621,how can i open the ti v guide
/workspace/data/synthesized_audio/Q309.wav,0.16715073585510254,how can i check how much storage is being ud
/workspace/data/synthesized_audio/Q032.wav,0.21622228622436523,how to u the play back buttons
/workspace/data/synthesized_audio/Q398.wav,0.17072486877441406,what can i do if the stand by light keeps blinking
/workspace/data/synthesized_audio/Q286.wav,0.19176912307739258,how can i turn text to speech
/workspace/data/synthesized_audio/Q052.wav,0.17250847816467285,how can i open the basic menu without the remote control
/workspace/data/synthesized_audio/Q008.wav,0.16915512084960938,how do i open the homescreen and open an item
/workspace/data/synthesized_audio/Q306.wav,0.2922091484069824,how can i u the twenty four hour format
/workspace/data/synthesized_audio/Q390.wav,0.34119105339050293,how can i u more help functions to diagnos issues and g more information about the tiv
/workspace/data/synthesized_audio/Q205.wav,0.13902878761291504,how do i set up custom ey i equalizer
/workspace/data/synthesized_audio/Q196.wav,0.14499998092651367,how to set up motion blir reduction
/workspace/data/synthesized_audio/Q257.wav,0.3812110424041748,how do i set up my fillips wireless home speakers to work with ambulite
/workspace/data/synthesized_audio/Q077.wav,0.2624812126159668,how can i set the content rating
/workspace/data/synthesized_audio/Q413.wav,0.18759727478027344,what can i do if h d ai y s c is not working properly
/workspace/data/synthesized_audio/Q334.wav,0.16772198677062988,how can i view the blue tooth registered device information
/workspace/data/synthesized_audio/Q230.wav,0.17843866348266602,how do i set up audio output
/workspace/data/synthesized_audio/Q023.wav,0.16632747650146484,how do i open the channel list while watching tivie
/workspace/data/synthesized_audio/Q351.wav,0.13482403755187988,how can i open the photo falder
/workspace/data/synthesized_audio/Q445.wav,0.15172672271728516,what is a m d frieink premium
/workspace/data/synthesized_audio/Q359.wav,0.2939426898956299,what can you tell me about browsing three hundred sixty photophils
/workspace/data/synthesized_audio/Q227.wav,0.16996288299560547,question how do i set up auto volume
/workspace/data/synthesized_audio/Q110.wav,0.15903639793395996,what can you tell me about h d a my arc and e a r c
/workspace/data/synthesized_audio/Q421.wav,0.13906145095825195,what can i do if i ' m unable to pair
/workspace/data/synthesized_audio/Q222.wav,0.17171430587768555,how do i set up d s c dynamic range control
/workspace/data/synthesized_audio/Q226.wav,0.32711243629455566,how to set up room callibration
/workspace/data/synthesized_audio/Q248.wav,0.24190878868103027,how do i set up lounge light mode
/workspace/data/synthesized_audio/Q214.wav,0.17803645133972168,question how do i set up mimi sound personalisation
/workspace/data/synthesized_audio/Q187.wav,0.1412827968597412,how to set wide color gamut
/workspace/data/synthesized_audio/Q046.wav,0.1688683032989502,how do i clean the remote control
/workspace/data/synthesized_audio/Q442.wav,0.2851290702819824,what is gogltivi
/workspace/data/synthesized_audio/Q250.wav,0.19322776794433594,how do i set ambilite brightness
/workspace/data/synthesized_audio/Q256.wav,0.180694580078125,how do i turn off phillips s wireless homespeakers that work with ambilite
/workspace/data/synthesized_audio/Q301.wav,0.16286206245422363,how can asss date in time setting
/workspace/data/synthesized_audio/Q314.wav,0.30481600761413574,precet time
/workspace/data/synthesized_audio/Q013.wav,0.20833611488342285,how do i inrt the power cable into the power connector
/workspace/data/synthesized_audio/Q311.wav,0.14444494247436523,how can i set the power behaviour
/workspace/data/synthesized_audio/Q216.wav,0.20410823822021484,how do i control the sound settings of my h d a my sound system via ezie link tou
/workspace/data/synthesized_audio/Q324.wav,0.22582292556762695,how can i adjust picture an audio in retail mode settings
/workspace/data/synthesized_audio/Q009.wav,0.30905961990356445,how do i find the safy instructions
/workspace/data/synthesized_audio/Q405.wav,0.1367964744567871,what can i do if the picture settings change after a while
/workspace/data/synthesized_audio/Q363.wav,0.16921782493591309,what can you tell me about browsing music files
/workspace/data/synthesized_audio/Q426.wav,0.1843409538269043,what should i do to trouble shoot any problems with a phillips tivie
/workspace/data/synthesized_audio/Q061.wav,0.25339341163635254,what are the conditions for the channelist copy
/workspace/data/synthesized_audio/Q199.wav,0.14149975776672363,how do i form out the picture manually
/workspace/data/synthesized_audio/Q249.wav,0.2141587734222412,how do i set the duration in minutes of the lounge light mode
/workspace/data/synthesized_audio/Q072.wav,0.26456761360168457,how to unlock a channel
/workspace/data/synthesized_audio/Q284.wav,0.11369681358337402,how can i switch accessibility
/workspace/data/synthesized_audio/Q270.wav,0.1731429100036621,what you can tell me about you to musicap
/workspace/data/synthesized_audio/Q177.wav,0.14883971214294434,how to set vidio lel
/workspace/data/synthesized_audio/Q172.wav,0.17723488807678223,how to set automatic picture and movie style
/workspace/data/synthesized_audio/Q192.wav,0.19984817504882812,how do i set up noise reduction
/workspace/data/synthesized_audio/Q117.wav,0.17219877243041992,could you tell me more about ezelnk
/workspace/data/synthesized_audio/Q264.wav,0.15095162391662598,what you can tell me about as
/workspace/data/synthesized_audio/Q415.wav,0.2801816463470459,what can i do if you sp file play back as choppy
/workspace/data/synthesized_audio/Q224.wav,0.19359803199768066,how do i set up sound stage
/workspace/data/synthesized_audio/Q221.wav,0.15221524238586426,how do i set up sor round sound
/workspace/data/synthesized_audio/Q005.wav,0.12009477615356445,how d do you i search gogltivi
/workspace/data/synthesized_audio/Q140.wav,0.17335796356201172,how can i adjust the volume in head phones
/workspace/data/synthesized_audio/Q313.wav,0.15582060813903809,how can i set the screen off to sa energy consumption
/workspace/data/synthesized_audio/Q364.wav,0.14701437950134277,how can i playing music fies
/workspace/data/synthesized_audio/Q316.wav,0.3076059818267822,what i need to u gogle cast
/workspace/data/synthesized_audio/Q308.wav,0.1332111358642578,how can i set the keyboard lay out for you a spee keyboard
/workspace/data/synthesized_audio/Q418.wav,0.19583868980407715,what can i do if the p c and intereate connection are slow
/workspace/data/synthesized_audio/Q190.wav,0.14902257919311523,how to set sharpness
/workspace/data/synthesized_audio/Q409.wav,0.322415828704834,what can i do if the computer picture is not stable
/workspace/data/synthesized_audio/Q403.wav,0.14258098602294922,what can i do about poor and tenna reception
/workspace/data/synthesized_audio/Q252.wav,0.16014671325683594,how do i set ambulite wall color
/workspace/data/synthesized_audio/Q298.wav,0.19802236557006836,does this television contain open sore soft ware
/workspace/data/synthesized_audio/Q094.wav,0.21735930442810059,how can i create a list of favourite channels
/workspace/data/synthesized_audio/Q305.wav,0.1829843521118164,how can i set the time zone
/workspace/data/synthesized_audio/Q071.wav,0.11861038208007812,how to lock a channel
/workspace/data/synthesized_audio/Q223.wav,0.12350153923034668,how do i set up hight speakers
/workspace/data/synthesized_audio/Q109.wav,0.16392016410827637,what can you tell me about copy protection
/workspace/data/synthesized_audio/Q057.wav,0.165008544921875,how can i start a manual channel up date my tevy
/workspace/data/synthesized_audio/Q356.wav,0.18029022216796875,how can i open three hundred sixty pho ohes folder
/workspace/data/synthesized_audio/Q251.wav,0.14990448951721191,how do i set ambolite saturation
/workspace/data/synthesized_audio/Q437.wav,0.152587890625,transportation in low temperatures
/workspace/data/synthesized_audio/Q297.wav,0.1736469268798828,how can i display tivy s status information
/workspace/data/synthesized_audio/Q337.wav,0.15283584594726562,how can i up date the remote control softwhere
/workspace/data/synthesized_audio/Q107.wav,0.2711153030395508,what can you tell me about h d a my quality
/workspace/data/synthesized_audio/Q089.wav,0.1427478790283203,how can i find service navigation
/workspace/data/synthesized_audio/Q164.wav,0.21840953826904297,how to configurr network and internat
/workspace/data/synthesized_audio/Q354.wav,0.17952775955200195,what can you tell me about browsing photophyes
/workspace/data/synthesized_audio/Q217.wav,0.14821076393127441,how do i set the sound style
/workspace/data/synthesized_audio/Q449.wav,0.30031681060791016,what is the copyright of the wife alliance
/workspace/data/synthesized_audio/Q318.wav,0.2244555950164795,how can i cast an up to the tive screen
/workspace/data/synthesized_audio/Q304.wav,0.16022849082946777,how can i set the time
/workspace/data/synthesized_audio/Q119.wav,0.18572044372558594,how can i set the signal quality for e h d and my connector
/workspace/data/synthesized_audio/Q122.wav,0.12705206871032715,ultra h d opions
/workspace/data/synthesized_audio/Q319.wav,0.16708111763000488,how can i enable or disable the system sounds
/workspace/data/synthesized_audio/Q236.wav,0.22241544723510742,how do i turn ambilighte
/workspace/data/synthesized_audio/Q066.wav,0.13786792755126953,h had a upload channel list to installed ti v s
/workspace/data/synthesized_audio/Q348.wav,0.21807265281677246,can you show me the control bar to play vittios
/workspace/data/synthesized_audio/Q210.wav,0.27223873138427734,how do i set up a d t s play fy compatible device
/workspace/data/synthesized_audio/Q127.wav,0.1751394271850586,what can you tell me about h d r ten plus or doulby
/workspace/data/synthesized_audio/Q049.wav,0.15250134468078613,how i can switch the te v to stand by
/workspace/data/synthesized_audio/Q215.wav,0.16265034675598145,how do i test my hearing and set up my hearing profile
/workspace/data/synthesized_audio/Q353.wav,0.2889401912689209,can you show me the control bar to play vittios
/workspace/data/synthesized_audio/Q014.wav,0.16658902168273926,how to inrt the antenna plug into the antena sock
/workspace/data/synthesized_audio/Q388.wav,0.24160552024841309,how can i open help
/workspace/data/synthesized_audio/Q175.wav,0.12258410453796387,how do i set the back light contrast
/workspace/data/synthesized_audio/Q368.wav,0.17634034156799316,how do i start a game a game consule or computer for the first time
/workspace/data/synthesized_audio/Q320.wav,0.22095918655395508,how can i set a new code or we set the change code for child lock
/workspace/data/synthesized_audio/Q366.wav,0.1371457576751709,how do i install games from the place door
/workspace/data/synthesized_audio/Q340.wav,0.11884880065917969,how can i add a folder or a file to the favorite ' s menu
/workspace/data/synthesized_audio/Q229.wav,0.3664374351501465,how do i set up dobi attmos ' s notification
/workspace/data/synthesized_audio/Q064.wav,0.16267633438110352,how can i check the current version of the channel list
/workspace/data/synthesized_audio/Q111.wav,0.33327150344848633,what can you tell me about h d a m a a s c
/workspace/data/synthesized_audio/Q160.wav,0.16561293601989746,do you have any notes for a m d grafhicx card urs
/workspace/data/synthesized_audio/Q161.wav,0.1818392276763916,how do i connect my ti v to the internt wirelessly
/workspace/data/synthesized_audio/Q081.wav,0.17875170707702637,what is audio language
/workspace/data/synthesized_audio/Q121.wav,0.32082080841064453,what is the maximum allowed in the setting standart to ultra h d
/workspace/data/synthesized_audio/Q219.wav,0.13915586471557617,how do i adjust the treble lel
/workspace/data/synthesized_audio/Q044.wav,0.19859743118286133,how do i u a remote control that u as i are infereread
/workspace/data/synthesized_audio/Q084.wav,0.15578007698059082,how can i set the mixed volume in awudio description
/workspace/data/synthesized_audio/Q246.wav,0.27395009994506836,how do i set the ambasleep colour
/workspace/data/synthesized_audio/Q209.wav,0.15419578552246094,how do i stream addio wirelessly to my speakers
/workspace/data/synthesized_audio/Q128.wav,0.16104984283447266,premium g sink games for supported t v models
/workspace/data/synthesized_audio/Q344.wav,0.20157909393310547,how could i view my photos or play music and vitios from a connected u s b flash dri or u s b hardri
/workspace/data/synthesized_audio/Q440.wav,0.14935564994812012,what are the terms of u tivie
/workspace/data/synthesized_audio/Q191.wav,0.2499828338623047,how do i set up textter enhanment
/workspace/data/synthesized_audio/Q258.wav,0.24007773399353027,how do i view the current configuration of philip ' s wireless home speakers with ambulite network and speaker ali dies
/workspace/data/synthesized_audio/Q120.wav,0.21793913841247559,what is the maximum allowed in the setting optimal to ultra h d
/workspace/data/synthesized_audio/Q159.wav,0.1800851821899414,do you have any notes for envitiographic s card urs
/workspace/data/synthesized_audio/Q237.wav,0.16418051719665527,how do i follow vidio
/workspace/data/synthesized_audio/Q451.wav,0.3135101795196533,what are the copyris of other trade marks
/workspace/data/synthesized_audio/Q416.wav,0.1541914939880371,what can i do if th the wife f hy net work not found or distorted
/workspace/data/synthesized_audio/Q431.wav,0.1824657917022705,what is the risk of injury or damage to the tiv
/workspace/data/synthesized_audio/Q142.wav,0.13828682899475098,how can i connect a u spi keyboard
/workspace/data/synthesized_audio/Q033.wav,0.18071460723876953,how do i open or close the ti ve guide
/workspace/data/synthesized_audio/Q254.wav,0.1617591381072998,how do i adjust ambulites warm white
/workspace/data/synthesized_audio/Q129.wav,0.20828771591186523,how to canect home theatre system with h d a i xc e a s c
/workspace/data/synthesized_audio/Q317.wav,0.18398523330688477,what can you tell me about as with gogle cast
/workspace/data/synthesized_audio/Q054.wav,0.17999863624572754,how can i change channels without the remote control
/workspace/data/synthesized_audio/Q401.wav,0.18209028244018555,what can i do if there ' s no picture or if the picture is distorted
/workspace/data/synthesized_audio/Q425.wav,0.17136287689208984,how can i change the language back to language in basic mode
/workspace/data/synthesized_audio/Q241.wav,0.1487431526184082,how to follow ap
/workspace/data/synthesized_audio/Q133.wav,0.16489744186401367,what can i do if sound with loud noise
/workspace/data/synthesized_audio/Q063.wav,0.16998767852783203,how can i copy a channelist
/workspace/data/synthesized_audio/Q360.wav,0.18790078163146973,how can i open music falder
/workspace/data/synthesized_audio/Q149.wav,0.2665238380432129,how can i stop watching the u s b storage content
/workspace/data/synthesized_audio/Q087.wav,0.18538975715637207,how can i set the dialogue enhancement in universal and hanchma
/workspace/data/synthesized_audio/Q396.wav,0.1709275245666504,what can i do if the te v makes a creaking sound at start up or when switching off
/workspace/data/synthesized_audio/Q136.wav,0.19652891159057617,what can you tell me about digidital audio out optacle
/workspace/data/synthesized_audio/Q341.wav,0.13933944702148438,how can i view favourite files
/workspace/data/synthesized_audio/Q098.wav,0.20416498184204102,tell me what is ti vi gaide data
/workspace/data/synthesized_audio/Q346.wav,0.17899060249328613,how can i open vitio fallder
/workspace/data/synthesized_audio/Q412.wav,0.17276668548583984,what can i do if h d and my easy link is not working
/workspace/data/synthesized_audio/Q276.wav,0.22884535789489746,what you can tell me about google play store and what is need to u
/workspace/data/synthesized_audio/Q220.wav,0.14661836624145508,how do i customize the equalizer
/workspace/data/synthesized_audio/Q059.wav,0.17141938209533691,what should i select after accessing the antennaicable installation option
/workspace/data/synthesized_audio/Q043.wav,0.15992450714111328,how do i perform a voy search
/workspace/data/synthesized_audio/Q183.wav,0.16267991065979004,how de set colr
/workspace/data/synthesized_audio/Q086.wav,0.15216064453125,how can i select speech in audio description
/workspace/data/synthesized_audio/Q168.wav,0.17307639122009277,how to access the quick menu and t v settings
/workspace/data/synthesized_audio/Q076.wav,0.21884870529174805,how can i switch off the parental age ratiding
/workspace/data/synthesized_audio/Q373.wav,0.1484072208404541,what can you tell me about alexea
/workspace/data/synthesized_audio/Q441.wav,0.17338299751281738,what are the terms of u smart tiv
/workspace/data/synthesized_audio/Q330.wav,0.12524986267089844,how can i connect or disconnect a blue tooth registered device
/workspace/data/synthesized_audio/Q408.wav,0.17081880569458008,what can i do if the picture position is incorrect
/workspace/data/synthesized_audio/Q365.wav,0.16417336463928223,how do i down lad the fillips ti v remote app
/workspace/data/synthesized_audio/Q419.wav,0.18073487281799316,what can i do if the connection fails
/workspace/data/synthesized_audio/Q381.wav,0.1447901725769043,what is the specification of the screen type
/workspace/data/synthesized_audio/Q378.wav,0.17830705642700195,what are the specifications for turning the product
/workspace/data/synthesized_audio/Q146.wav,0.2836441993713379,what can you tell me about special keys for aps and intner net pages
/workspace/data/synthesized_audio/Q279.wav,0.18585658073425293,what to do if goog play doore is not in the aps row
/workspace/data/synthesized_audio/Q435.wav,0.14107275009155273,what about lightning storms
/workspace/data/synthesized_audio/Q235.wav,0.19339919090270996,how do i set the digital out put off set
/workspace/data/synthesized_audio/Q322.wav,0.2035832405090332,how can i select the location the tivie in retail mode settings
/workspace/data/synthesized_audio/Q329.wav,0.1996631622314453,how can i pare a blue tooth registered device with the ti v
/workspace/data/synthesized_audio/Q144.wav,0.17109918594360352,how can i change the keyboard lay out
/workspace/data/synthesized_audio/Q338.wav,0.4340362548828125,how could i view my photos or play my music and vidios from a computer or a n a s net worork attach storage my home net work
/workspace/data/synthesized_audio/Q097.wav,0.27538275718688965,how can i remo a favourite list
/workspace/data/synthesized_audio/Q303.wav,0.251331090927124,how can i set the date
/workspace/data/synthesized_audio/Q186.wav,0.16603851318359375,how to set up color enhancement
/workspace/data/synthesized_audio/Q080.wav,0.20035004615783691,how can i switch to mono or stereo
/workspace/data/synthesized_audio/Q347.wav,0.16702485084533691,how can i play a vidio
/workspace/data/synthesized_audio/Q003.wav,0.1260390281677246,how to g personalized recommendations of streaming services
/workspace/data/synthesized_audio/Q015.wav,0.30088162422180176,how to g an over view of the keys top
/workspace/data/synthesized_audio/Q374.wav,0.18833160400390625,what is needed to control the t v with elexa
/workspace/data/synthesized_audio/Q447.wav,0.15631914138793945,what is the copyrie of d t s x
/workspace/data/synthesized_audio/Q067.wav,0.13096356391906738,how can i tune to a channel
/workspace/data/synthesized_audio/Q387.wav,0.17539167404174805,how can i register the tivi to enjoy a range of benefits
/workspace/data/synthesized_audio/Q243.wav,0.19166803359985352,how do i start ambas sleep
/workspace/data/synthesized_audio/Q339.wav,0.18313002586364746,how can i brow and play the files computer
/workspace/data/synthesized_audio/Q349.wav,0.15298032760620117,what can you tell me about browsing vitiophiles
/workspace/data/synthesized_audio/Q397.wav,0.15367984771728516,what can i do if the t v doesn ' t respond to the remote control
/workspace/data/synthesized_audio/Q108.wav,0.13883566856384277,what to do if a device connected with h d a m i is not working
/workspace/data/synthesized_audio/Q038.wav,0.2296156883239746,how do i mute or restore sound
/workspace/data/synthesized_audio/Q056.wav,0.20426559448242188,how can i access deno to start a demo movie
/workspace/data/synthesized_audio/Q195.wav,0.12635302543640137,how do i set smoothness
/workspace/data/synthesized_audio/Q420.wav,0.14826202392578125,what can i do if streaming vitio quality is poor
/workspace/data/synthesized_audio/Q115.wav,0.174210786819458,how can i power r off h d a my devices with the ti v
/workspace/data/synthesized_audio/Q078.wav,0.16638612747192383,how can i open the chanelopptions
/workspace/data/synthesized_audio/Q180.wav,0.14597558975219727,how do i set contrast enhancement dynamic enhanment lel
/workspace/data/synthesized_audio/Q375.wav,0.13492918014526367,what can you tell me about alex of skills
/workspace/data/synthesized_audio/Q025.wav,0.15062880516052246,how do i return to the previous menu
/workspace/data/synthesized_audio/Q184.wav,0.15156006813049316,how to set saturation
/workspace/data/synthesized_audio/Q173.wav,0.1788346767425537,how do i turn and off the automatic picture and movie style setting
/workspace/data/synthesized_audio/Q028.wav,0.14618563652038574,how to open the helloppionin
/workspace/data/synthesized_audio/Q213.wav,0.31975269317626953,how do i set up my home theatre system with my t v and playfight t v speakers
/workspace/data/synthesized_audio/Q169.wav,0.17719602584838867,how do i set the t v image
/workspace/data/synthesized_audio/Q017.wav,0.14857721328735352,how do i starty net flicks up
/workspace/data/synthesized_audio/Q262.wav,0.1713564395904541,how to start the aurora app
/workspace/data/synthesized_audio/Q041.wav,0.16770315170288086,how do i check the soft weare information of the remote control
/workspace/data/synthesized_audio/Q281.wav,0.28868937492370605,how can i add a credic card googl playtivi
/workspace/data/synthesized_audio/Q124.wav,0.18224048614501953,what happens if i set optimal auto game
/workspace/data/synthesized_audio/Q287.wav,0.2687206268310547,how can i turn accessibility shortcut
/workspace/data/synthesized_audio/Q211.wav,0.18411850929260254,how do i set up a wireless d t s play fye surround compatible device
/workspace/data/synthesized_audio/Q352.wav,0.2809865474700928,how can i view a phooto
/workspace/data/synthesized_audio/Q158.wav,0.3084416389465332,how can i connect a computer to the tivie
/workspace/data/synthesized_audio/Q370.wav,0.23368215560913086,how do i seit up the setting ' s bar
/workspace/data/synthesized_audio/Q395.wav,0.27504706382751465,what can i do if the ti v does not turn
/workspace/data/synthesized_audio/Q096.wav,0.14765214920043945,how can i renain a favourite ' list
/workspace/data/synthesized_audio/Q438.wav,0.1559615135192871,what should i do if my ti v has moisture lels the front
/workspace/data/synthesized_audio/Q328.wav,0.26489734649658203,what you can tell about par accessory
/workspace/data/synthesized_audio/Q253.wav,0.14818406105041504,how do i set ambil lighte to turn off immediately
/workspace/data/synthesized_audio/Q290.wav,0.17711973190307617,how cin i soft wear up date by mylf
/workspace/data/synthesized_audio/Q093.wav,0.1401069164276123,how can i select a channel from the favorite list
/workspace/data/synthesized_audio/Q268.wav,0.16387939453125,how can i watch a rented or purchase movy or t v show in gungle ti vi aap
