audio_file,tempo,transcricao
/workspace/data/synthesized_audio/Q362.wav,0.07787799835205078,can you show me the control bar for playing music
/workspace/data/synthesized_audio/Q203.wav,0.056247711181640625,how do i set clear dialogue
/workspace/data/synthesized_audio/Q429.wav,0.07972240447998047,why should you read the safety instructions before using the t v
/workspace/data/synthesized_audio/Q267.wav,0.09671974182128906,how can i rent or buy a movie or t v show in google t v app
/workspace/data/synthesized_audio/Q019.wav,0.0867166519165039,how to open the list of installed applications
/workspace/data/synthesized_audio/Q200.wav,0.07251381874084473,how do i select a sound style
/workspace/data/synthesized_audio/Q011.wav,0.0869443416595459,what dimensions should i consider when buying the wall mount
/workspace/data/synthesized_audio/Q153.wav,0.09289765357971191,how can i view photos stored on digital photo camera
/workspace/data/synthesized_audio/Q385.wav,0.06165456771850586,what are the sound specks
/workspace/data/synthesized_audio/Q106.wav,0.06558632850646973,what can you tell me about antennaport
/workspace/data/synthesized_audio/Q372.wav,0.08186483383178711,how do i open netflix
/workspace/data/synthesized_audio/Q166.wav,0.08491992950439453,how do i start the internet browser
/workspace/data/synthesized_audio/Q255.wav,0.1179964542388916,how to set up philliip's wireless home speakers with ambolite
/workspace/data/synthesized_audio/Q178.wav,0.12383151054382324,how do i set dark details gama
/workspace/data/synthesized_audio/Q047.wav,0.08961319923400879,how can i switch the t v on
/workspace/data/synthesized_audio/Q152.wav,0.14829754829406738,how can i have more information in watching or playing content from a u s b storage device
/workspace/data/synthesized_audio/Q029.wav,0.11164641380310059,how to open direct selection of options
/workspace/data/synthesized_audio/Q010.wav,0.10638999938964844,how to find assembly instructions of the t v stand
/workspace/data/synthesized_audio/Q114.wav,0.17545795440673828,how can i operate h dm i c c compatible devices with tv remote control
/workspace/data/synthesized_audio/Q181.wav,0.09362983703613281,how to set up h d r tone mapping
/workspace/data/synthesized_audio/Q036.wav,0.0919637680053711,how to insert digital subchnnels
/workspace/data/synthesized_audio/Q099.wav,0.09590387344360352,how can i open the t v guide
/workspace/data/synthesized_audio/Q309.wav,0.10754203796386719,how can i check how much storage is being used
/workspace/data/synthesized_audio/Q032.wav,0.09313178062438965,how to use the playback buttons
/workspace/data/synthesized_audio/Q398.wav,0.10967230796813965,what can i do if the standb light keeps blinking
/workspace/data/synthesized_audio/Q286.wav,0.09717273712158203,how can i turn on text to speech
/workspace/data/synthesized_audio/Q052.wav,0.11802005767822266,how can i open the basic menu without the remote control
/workspace/data/synthesized_audio/Q008.wav,0.10927844047546387,how do i open the home screen and open an item
/workspace/data/synthesized_audio/Q306.wav,0.10214591026306152,how can i use the twenty four hour format
/workspace/data/synthesized_audio/Q390.wav,0.14510154724121094,how can i use more help functions to diagnose issues and get more information about the t v
/workspace/data/synthesized_audio/Q205.wav,0.10135269165039062,how do i set up custom a i equalizer
/workspace/data/synthesized_audio/Q196.wav,0.1369795799255371,how to set up motion blar reduction
/workspace/data/synthesized_audio/Q257.wav,0.16803860664367676,how do i set up my phillips wireless homepeakers to work with ambolite
/workspace/data/synthesized_audio/Q077.wav,0.1228494644165039,how can i set the content rating
/workspace/data/synthesized_audio/Q413.wav,0.12906265258789062,what can i do if hdmmi erc is not working properly
/workspace/data/synthesized_audio/Q334.wav,0.12086844444274902,how can i view the blue toooth registered device information
/workspace/data/synthesized_audio/Q230.wav,0.09602928161621094,how do i set up audio output
/workspace/data/synthesized_audio/Q023.wav,0.1259288787841797,how do i open the channel list while watching t v
/workspace/data/synthesized_audio/Q351.wav,0.10873198509216309,how can i open the photo folder
/workspace/data/synthesized_audio/Q445.wav,0.10805773735046387,what is a m d free siin premium
/workspace/data/synthesized_audio/Q359.wav,0.11128473281860352,what can you tell me about browsing three hundred sixty photoopilles
/workspace/data/synthesized_audio/Q227.wav,0.11169219017028809,question how do i set up auto volume
/workspace/data/synthesized_audio/Q110.wav,0.1182093620300293,what can you tell me about h d m my arc and e ar c
/workspace/data/synthesized_audio/Q421.wav,0.10470032691955566,what can i do if i' am unable to pair
/workspace/data/synthesized_audio/Q222.wav,0.10336542129516602,how do i set up dr c dynamic range control
/workspace/data/synthesized_audio/Q226.wav,0.0957036018371582,how to set up room calibration
/workspace/data/synthesized_audio/Q248.wav,0.08920001983642578,how do i set up lounge light mode
/workspace/data/synthesized_audio/Q214.wav,0.12093544006347656,question how do i set up mimi sound personalization
/workspace/data/synthesized_audio/Q187.wav,0.08912372589111328,how to set wide coolor gamut
/workspace/data/synthesized_audio/Q046.wav,0.1584761142730713,how do i clean the remote control
/workspace/data/synthesized_audio/Q442.wav,0.11541247367858887,what is google t v
/workspace/data/synthesized_audio/Q250.wav,0.09428882598876953,how do i set ambolite brightness
/workspace/data/synthesized_audio/Q256.wav,0.14652585983276367,how do i turn on off phillips wireless home speakers that work with ambolite
/workspace/data/synthesized_audio/Q301.wav,0.10937190055847168,how can assess date and time setting
/workspace/data/synthesized_audio/Q314.wav,0.0875844955444336,preceet time
/workspace/data/synthesized_audio/Q013.wav,0.14479970932006836,how do i insert the power cable into the power connector
/workspace/data/synthesized_audio/Q311.wav,0.10109400749206543,how can i set the power on behaviour
/workspace/data/synthesized_audio/Q216.wav,0.14181923866271973,how do i control the sound settings of my h d m i sound system via easy link too
/workspace/data/synthesized_audio/Q324.wav,0.11953067779541016,how can i adjust picture and audio in retail mode settings
/workspace/data/synthesized_audio/Q009.wav,0.11984682083129883,how do i find the safety instructions
/workspace/data/synthesized_audio/Q405.wav,0.11889910697937012,what can i do if the picture settings change after a while
/workspace/data/synthesized_audio/Q363.wav,0.0992894172668457,what can you tell me about browsing music files
/workspace/data/synthesized_audio/Q426.wav,0.11478567123413086,what should i do to trouble shoot any problems with a phillip's t v
/workspace/data/synthesized_audio/Q061.wav,0.11446833610534668,what are the conditions for the channelist copy
/workspace/data/synthesized_audio/Q199.wav,0.10165071487426758,how do i format the picture manually
/workspace/data/synthesized_audio/Q249.wav,0.12177395820617676,how do i set the duration in minutes of the lounge light mode
/workspace/data/synthesized_audio/Q072.wav,0.09078335762023926,how to unlock a channel
/workspace/data/synthesized_audio/Q284.wav,0.11579608917236328,how can i switch on accessibility
/workspace/data/synthesized_audio/Q270.wav,0.12518310546875,what you can tell me about youtube music appp
/workspace/data/synthesized_audio/Q177.wav,0.09807395935058594,how to set video level
/workspace/data/synthesized_audio/Q172.wav,0.10932803153991699,how to set automatic picture and movie style
/workspace/data/synthesized_audio/Q192.wav,0.09497356414794922,how do i set up noise reduction
/workspace/data/synthesized_audio/Q117.wav,0.11475467681884766,could you tell me more about ezink
/workspace/data/synthesized_audio/Q264.wav,0.08740806579589844,what you can tell me about aps
/workspace/data/synthesized_audio/Q415.wav,0.12824082374572754,what can i do if u s b file playback is choppy
/workspace/data/synthesized_audio/Q224.wav,0.09820318222045898,how do i set up sound stage
/workspace/data/synthesized_audio/Q221.wav,0.20687580108642578,how do i set up surround sound
/workspace/data/synthesized_audio/Q005.wav,0.08848714828491211,how did do a search on google t v
/workspace/data/synthesized_audio/Q140.wav,0.11701631546020508,how can i adjust the volume in headphones
/workspace/data/synthesized_audio/Q313.wav,0.10789799690246582,how can i set the screen off to save energy consumption
/workspace/data/synthesized_audio/Q364.wav,0.10182476043701172,how can i playing music files
/workspace/data/synthesized_audio/Q316.wav,0.09850788116455078,what i need to use google cast
/workspace/data/synthesized_audio/Q308.wav,0.11355376243591309,how can i set the keyboard layo for u s b keyboard
/workspace/data/synthesized_audio/Q418.wav,0.23470640182495117,what can i do if the p c and internet connection are slow
/workspace/data/synthesized_audio/Q190.wav,0.0823979377746582,how to set sharpness
/workspace/data/synthesized_audio/Q409.wav,0.10853290557861328,what can i do if the computer picture is not stable
/workspace/data/synthesized_audio/Q403.wav,0.12659502029418945,what can i do about poor antenna reception
/workspace/data/synthesized_audio/Q252.wav,0.0786895751953125,how do i set ambolite wall color
/workspace/data/synthesized_audio/Q298.wav,0.08215785026550293,does this television contain open source software
/workspace/data/synthesized_audio/Q094.wav,0.07916092872619629,how can i create a list of favorite channels
/workspace/data/synthesized_audio/Q305.wav,0.186812162399292,how can i set the time zone
/workspace/data/synthesized_audio/Q071.wav,0.36322927474975586,how to lock a channel
/workspace/data/synthesized_audio/Q223.wav,0.08366084098815918,how do i set up piight speakers
/workspace/data/synthesized_audio/Q109.wav,0.11775040626525879,what can you tell me about copy protection
/workspace/data/synthesized_audio/Q057.wav,0.10173177719116211,how can i start a manual channel update on my t v
/workspace/data/synthesized_audio/Q356.wav,0.12122297286987305,how can i open three hundred sixty photos folder
/workspace/data/synthesized_audio/Q251.wav,0.10045051574707031,how do i set ambolite saturation
/workspace/data/synthesized_audio/Q437.wav,0.08735513687133789,transportation in low temperatures
/workspace/data/synthesized_audio/Q297.wav,0.10449433326721191,how can i display t v status information
/workspace/data/synthesized_audio/Q337.wav,0.11983776092529297,how can i update the remote control software
/workspace/data/synthesized_audio/Q107.wav,0.09023046493530273,what can you tell me about h d m i quality
/workspace/data/synthesized_audio/Q089.wav,0.21669936180114746,how can i find service navigation
/workspace/data/synthesized_audio/Q164.wav,0.11846637725830078,how to configure network and internet
/workspace/data/synthesized_audio/Q354.wav,0.19748520851135254,what can you tell me about browsing photo files
/workspace/data/synthesized_audio/Q217.wav,0.09372639656066895,how do i set the sound style
/workspace/data/synthesized_audio/Q449.wav,0.07068014144897461,what is the copyright of the wi fi alliance
/workspace/data/synthesized_audio/Q318.wav,0.08368301391601562,how can i cast an appp to the t v screen
/workspace/data/synthesized_audio/Q304.wav,0.06669211387634277,how can i set the time
/workspace/data/synthesized_audio/Q119.wav,0.09891939163208008,how can i set the signal quality for each h d m i connector
/workspace/data/synthesized_audio/Q122.wav,0.07014822959899902,ultra h d options
/workspace/data/synthesized_audio/Q319.wav,0.09639573097229004,how can i enable or disable the system sounds
/workspace/data/synthesized_audio/Q236.wav,0.06670880317687988,how do i turn on ambolite
/workspace/data/synthesized_audio/Q066.wav,0.09528255462646484,how to upload channel list to an installed t v s
/workspace/data/synthesized_audio/Q348.wav,0.0735929012298584,can you show me the control bar to play videos
/workspace/data/synthesized_audio/Q210.wav,0.09529232978820801,how do i set up a d t s play by compatible device
/workspace/data/synthesized_audio/Q127.wav,0.11173462867736816,what can you tell me about h d r ten plus or dolby
/workspace/data/synthesized_audio/Q049.wav,0.0964195728302002,how i can switch the t v to stand by
/workspace/data/synthesized_audio/Q215.wav,0.12847471237182617,how do i test my hearing and set up my hearing profile
/workspace/data/synthesized_audio/Q353.wav,0.11448240280151367,can you show me the control bar to play videos
/workspace/data/synthesized_audio/Q014.wav,0.10654067993164062,how to insert the antenna plug into the antenna socket
/workspace/data/synthesized_audio/Q388.wav,0.0918588638305664,how can i open help
/workspace/data/synthesized_audio/Q175.wav,0.09096527099609375,how do i set the back like contrast
/workspace/data/synthesized_audio/Q368.wav,0.11988425254821777,how do i start a game on a game console or computer for the first time
/workspace/data/synthesized_audio/Q320.wav,0.13301682472229004,how can i set a new code or reset the change code for child lock
/workspace/data/synthesized_audio/Q366.wav,0.10958123207092285,how do i install games from the playstore
/workspace/data/synthesized_audio/Q340.wav,0.11186456680297852,how can i add a folder or a file to the favorite's menu
/workspace/data/synthesized_audio/Q229.wav,0.1169593334197998,how do i set up dulby atmo's notification
/workspace/data/synthesized_audio/Q064.wav,0.11866092681884766,how can i check the current version of the channel list
/workspace/data/synthesized_audio/Q111.wav,0.11344456672668457,what can you tell me about h d m i erc
/workspace/data/synthesized_audio/Q160.wav,0.12282013893127441,do you have any notes for a m d graphics card users
/workspace/data/synthesized_audio/Q161.wav,0.12918734550476074,how do i connect my t v to the internet wirelessly
/workspace/data/synthesized_audio/Q081.wav,0.08705592155456543,what is audio language
/workspace/data/synthesized_audio/Q121.wav,0.16619181632995605,what is the maximum allowed in the setting standart to ultra h d
/workspace/data/synthesized_audio/Q219.wav,0.09913182258605957,how do i adjust the treble level
/workspace/data/synthesized_audio/Q044.wav,0.12136054039001465,how do i use a remote control that uses i r infred
/workspace/data/synthesized_audio/Q084.wav,0.12641572952270508,how can i set the mixed volume in audio description
/workspace/data/synthesized_audio/Q246.wav,0.08841204643249512,how do i set the ambsleep color
/workspace/data/synthesized_audio/Q209.wav,0.09931063652038574,how do i stream audio wirelessly to my speakers
/workspace/data/synthesized_audio/Q128.wav,0.22479033470153809,premium g sink games for supported t v models
/workspace/data/synthesized_audio/Q344.wav,0.21504592895507812,how could i view my photos or play music in videos from a connected u s b flash drive or u s b hard drive
/workspace/data/synthesized_audio/Q440.wav,0.11736059188842773,what are the terms of use t v
/workspace/data/synthesized_audio/Q191.wav,0.09778523445129395,how do i set up texture enhancement
/workspace/data/synthesized_audio/Q258.wav,0.16828703880310059,how do i view the current configuration of philip's wireless home speakers with ambolite network and speaker l e ds
/workspace/data/synthesized_audio/Q120.wav,0.1297304630279541,what is the maximum allowed in the setting optimal to ultra h d
/workspace/data/synthesized_audio/Q159.wav,0.11060070991516113,do you have any notes for in videographics card users
/workspace/data/synthesized_audio/Q237.wav,0.09461212158203125,how do i follow video
/workspace/data/synthesized_audio/Q451.wav,0.08528590202331543,what are the copyrights of other trademarks
/workspace/data/synthesized_audio/Q416.wav,0.12474703788757324,what can i do if the wifi network not found or distorted
/workspace/data/synthesized_audio/Q431.wav,0.10092687606811523,what is the risk of injury or damage to the t v
/workspace/data/synthesized_audio/Q142.wav,0.10297942161560059,how can i connect a u s b keyboard
/workspace/data/synthesized_audio/Q033.wav,0.12429928779602051,how do i open or close the t v guide
/workspace/data/synthesized_audio/Q254.wav,0.10548973083496094,how do i adjust ambolite's warm white
/workspace/data/synthesized_audio/Q129.wav,0.13780951499938965,how to connect home theatre system with h d m i r e arc
/workspace/data/synthesized_audio/Q317.wav,0.10693764686584473,what can you tell me about apps with google cast
/workspace/data/synthesized_audio/Q054.wav,0.10644078254699707,how can i change channels without the remote control
/workspace/data/synthesized_audio/Q401.wav,0.11623454093933105,what can i do if there's no picture or if the picture is distorted
/workspace/data/synthesized_audio/Q425.wav,0.14262938499450684,how can i change the language back to language in basic mode
/workspace/data/synthesized_audio/Q241.wav,0.1193845272064209,how to follow app
/workspace/data/synthesized_audio/Q133.wav,0.10638713836669922,what can i do if sound with loud noise
/workspace/data/synthesized_audio/Q063.wav,0.13128376007080078,how can i copy a channelist
/workspace/data/synthesized_audio/Q360.wav,0.09344053268432617,how can i open music folder
/workspace/data/synthesized_audio/Q149.wav,0.10275530815124512,how can i stop watching the u s b storage content
/workspace/data/synthesized_audio/Q087.wav,0.1411914825439453,how can i set the dialogue enhancement in universal and hanchmath
/workspace/data/synthesized_audio/Q396.wav,0.150787353515625,what can i do if the t v makes a creaking sound at start up or when switching off
/workspace/data/synthesized_audio/Q136.wav,0.1058039665222168,what can you tell me about digital audio out optical
/workspace/data/synthesized_audio/Q341.wav,0.08812117576599121,how can i view favorite files
/workspace/data/synthesized_audio/Q098.wav,0.10041570663452148,tell me what is t v guid data
/workspace/data/synthesized_audio/Q346.wav,0.0855715274810791,how can i open video folder
/workspace/data/synthesized_audio/Q412.wav,0.12286090850830078,what can i do if h d m i easy link is not working
/workspace/data/synthesized_audio/Q276.wav,0.1275324821472168,what you can tell me about google play store and what is need to use
/workspace/data/synthesized_audio/Q220.wav,0.09467720985412598,how do i customize the equalizer
/workspace/data/synthesized_audio/Q059.wav,0.1424694061279297,what should i select after accessing the antenna cable installation option
/workspace/data/synthesized_audio/Q043.wav,0.09260940551757812,how do i perform a voiceerage
/workspace/data/synthesized_audio/Q183.wav,0.09523558616638184,how to set color
/workspace/data/synthesized_audio/Q086.wav,0.09892082214355469,how can i select speech in audio description
/workspace/data/synthesized_audio/Q168.wav,0.132002592086792,how to access the quick menu and t v settings
/workspace/data/synthesized_audio/Q076.wav,0.11829543113708496,how can i switch off the parental age rating
/workspace/data/synthesized_audio/Q373.wav,0.09816241264343262,what can you tell me about alexa
/workspace/data/synthesized_audio/Q441.wav,0.10095763206481934,what are the terms of use smart tv
/workspace/data/synthesized_audio/Q330.wav,0.1472642421722412,how can i connect or disconnect a blue toooth registered device
/workspace/data/synthesized_audio/Q408.wav,0.10324478149414062,what can i do if the picture position is incorrect
/workspace/data/synthesized_audio/Q365.wav,0.11129617691040039,how do i download the philip's t v remote app
/workspace/data/synthesized_audio/Q419.wav,0.09955000877380371,what can i do if that the connection fails
/workspace/data/synthesized_audio/Q381.wav,0.09042525291442871,what is the specification of the screen type
/workspace/data/synthesized_audio/Q378.wav,0.09607505798339844,what are the specifications for turning on the product
/workspace/data/synthesized_audio/Q146.wav,0.1070396900177002,what can you tell me about special keys for apps and internet pages
/workspace/data/synthesized_audio/Q279.wav,0.11105465888977051,what to do if google playstore is not in the apsrow
/workspace/data/synthesized_audio/Q435.wav,0.09288835525512695,what about lightning storms
/workspace/data/synthesized_audio/Q235.wav,0.1036980152130127,how do i set the digital output off set
/workspace/data/synthesized_audio/Q322.wav,0.12945556640625,how can i select the location on the t v in retail mode settings
/workspace/data/synthesized_audio/Q329.wav,0.11388349533081055,how can i pair a blue toooth registered device with the t v
/workspace/data/synthesized_audio/Q144.wav,0.0957632064819336,how can i change the keyboard layout
/workspace/data/synthesized_audio/Q338.wav,0.18272924423217773,how could i view my photos or play my music in videos from a computer or an n a s network attach storage on my home network
/workspace/data/synthesized_audio/Q097.wav,0.09937477111816406,how can i remove a favorite's list
/workspace/data/synthesized_audio/Q303.wav,0.0890817642211914,how can i set the date
/workspace/data/synthesized_audio/Q186.wav,0.12599730491638184,how to set up color enhancement
/workspace/data/synthesized_audio/Q080.wav,0.07590293884277344,how can i switch to manno or stereo
/workspace/data/synthesized_audio/Q347.wav,0.0890955924987793,how can i play a video
/workspace/data/synthesized_audio/Q003.wav,0.09906268119812012,how to get personalized recommendations of streaming services
/workspace/data/synthesized_audio/Q015.wav,0.12503623962402344,how to get an overview of the keys top
/workspace/data/synthesized_audio/Q374.wav,0.11498761177062988,what is needed to control the t v with alexa
/workspace/data/synthesized_audio/Q447.wav,0.08109045028686523,what is the copyright of d t s x
/workspace/data/synthesized_audio/Q067.wav,0.06730055809020996,how can i tune to a channel
/workspace/data/synthesized_audio/Q387.wav,0.10436701774597168,how can i register the t v to enjoy a range of benefits
/workspace/data/synthesized_audio/Q243.wav,0.11103630065917969,how do i start amb asleep
/workspace/data/synthesized_audio/Q339.wav,0.11006546020507812,how can i browse and play the files on computer
/workspace/data/synthesized_audio/Q349.wav,0.08928656578063965,what can you tell me about browsing videooples
/workspace/data/synthesized_audio/Q397.wav,0.10053181648254395,what can i do if the t v doesn't respond to the remote control
/workspace/data/synthesized_audio/Q108.wav,0.11299896240234375,what to do if a device connected with h dm i is not working
/workspace/data/synthesized_audio/Q038.wav,0.07296943664550781,how do i mute or restore sound
/workspace/data/synthesized_audio/Q056.wav,0.09680461883544922,how can i access demo to start a demo movie
/workspace/data/synthesized_audio/Q195.wav,0.1058511734008789,how do i set smoothness
/workspace/data/synthesized_audio/Q420.wav,0.0829160213470459,what can i do if streaming video quality is poor
/workspace/data/synthesized_audio/Q115.wav,0.11514711380004883,how can i power off h d m my devices with the tv
/workspace/data/synthesized_audio/Q078.wav,0.08796310424804688,how can i open the channel options
/workspace/data/synthesized_audio/Q180.wav,0.12819910049438477,how do i set contrast enhancement dynamic enhancement level
/workspace/data/synthesized_audio/Q375.wav,0.10456085205078125,what can you tell me about alexa skills
/workspace/data/synthesized_audio/Q025.wav,0.090911865234375,how do i return to the previous menu
/workspace/data/synthesized_audio/Q184.wav,0.08692812919616699,how to set saturation
/workspace/data/synthesized_audio/Q173.wav,0.12441444396972656,how do i turn on and off the automatic picture and movie style setting
/workspace/data/synthesized_audio/Q028.wav,0.08926677703857422,how to open the hell option
/workspace/data/synthesized_audio/Q213.wav,0.17260479927062988,how do i set up my home theatre system with my t v and play five t v speakers
/workspace/data/synthesized_audio/Q169.wav,0.1145179271697998,how do i set the t v image
/workspace/data/synthesized_audio/Q017.wav,0.10529398918151855,how do i start the net flicks apppp
/workspace/data/synthesized_audio/Q262.wav,0.09360980987548828,how to start the aurora app
/workspace/data/synthesized_audio/Q041.wav,0.12692642211914062,how do i check the software information of the remote control
/workspace/data/synthesized_audio/Q281.wav,0.11539149284362793,how can i add a credit card on google play on t v
/workspace/data/synthesized_audio/Q124.wav,0.10171318054199219,what happens if i set optimal auto game
/workspace/data/synthesized_audio/Q287.wav,0.09678387641906738,how can i turn on accessibility short cut
/workspace/data/synthesized_audio/Q211.wav,0.13741612434387207,how do i set up a wireless d t s playf surround compatible device
/workspace/data/synthesized_audio/Q352.wav,0.0885310173034668,how can i view a photo
/workspace/data/synthesized_audio/Q158.wav,0.0909416675567627,how can i connect a computer to the t v
/workspace/data/synthesized_audio/Q370.wav,0.08346438407897949,how do i set up the settings bar
/workspace/data/synthesized_audio/Q395.wav,0.10178208351135254,what can i do if the t v does not turn on
/workspace/data/synthesized_audio/Q096.wav,0.09952473640441895,how can i rename a favorite's list
/workspace/data/synthesized_audio/Q438.wav,0.12398529052734375,what should i do if my t v has moisture levels on the front
/workspace/data/synthesized_audio/Q328.wav,0.12593936920166016,what you can tell about perir accessory
/workspace/data/synthesized_audio/Q253.wav,0.10418295860290527,how do i set ambolite to turn off immediately
/workspace/data/synthesized_audio/Q290.wav,0.09963846206665039,how can i software update by myself
/workspace/data/synthesized_audio/Q093.wav,0.10513854026794434,how can i select a channel from the favorite's list
/workspace/data/synthesized_audio/Q268.wav,0.14606881141662598,how can i watch a rented or purchase movie or t v show in google t v app
