audio_file,tempo,transcricao
/workspace/data/synthesized_audio/Q004.wav,0.9473979473114014,how to find quickly a particular application
/workspace/data/synthesized_audio/Q204.wav,0.8116822242736816,how do i set up a i equalizer
/workspace/data/synthesized_audio/Q296.wav,1.1640055179595947,how can i reset all settings value to original tv settings
/workspace/data/synthesized_audio/Q336.wav,1.0373640060424805,how can i view the remote control information
/workspace/data/synthesized_audio/Q245.wav,0.7290472984313965,how do i set brightness
/workspace/data/synthesized_audio/Q020.wav,1.1110351085662842,how to open the quick menu with common t v functions
/workspace/data/synthesized_audio/Q228.wav,0.8430392742156982,how do i set up control volume
/workspace/data/synthesized_audio/Q325.wav,1.0781631469726562,how can i set logos and banner in retail mode settings
/workspace/data/synthesized_audio/Q150.wav,1.0174872875213623,how can i remove the usb storage device safely
/workspace/data/synthesized_audio/Q295.wav,0.9133124351501465,how can i reinstall tv
/workspace/data/synthesized_audio/Q070.wav,0.7348549365997314,what is loc channel
/workspace/data/synthesized_audio/Q095.wav,1.3540146350860596,how can i add a consecutive range of channels to a favorites list in one go
/workspace/data/synthesized_audio/Q274.wav,1.0567255020141602,how can i select and install new games apps on tv
/workspace/data/synthesized_audio/Q126.wav,0.7703392505645752,what can you tell me about j synk
/workspace/data/synthesized_audio/Q002.wav,0.8063302040100098,how do i access the home screen
/workspace/data/synthesized_audio/Q208.wav,1.0406899452209473,how do i set up dts playfie surround wirelessly
/workspace/data/synthesized_audio/Q073.wav,1.0025229454040527,how to lock or unlock channels in a channel list
/workspace/data/synthesized_audio/Q404.wav,1.009223222732544,what can i do about poor picture quality from a device
/workspace/data/synthesized_audio/Q139.wav,0.7511677742004395,what can you tell me about headphones
/workspace/data/synthesized_audio/Q450.wav,0.8323049545288086,what are kensington's copyrights
/workspace/data/synthesized_audio/Q007.wav,1.1885061264038086,how do i set between google tv mode and basic mode
/workspace/data/synthesized_audio/Q310.wav,0.8262333869934082,how can i set ambient mode
/workspace/data/synthesized_audio/Q182.wav,0.6488752365112305,how does that h d r effect
/workspace/data/synthesized_audio/Q423.wav,1.5585331916809082,what can i do if bluetooth registered audio and video synchronization is not working properly
/workspace/data/synthesized_audio/Q299.wav,0.9331891536712646,what you can tell me about open source license
/workspace/data/synthesized_audio/Q371.wav,1.2332398891448975,how to set up spatial audio sound effect for netflix content
/workspace/data/synthesized_audio/Q259.wav,0.5998222827911377,home speakers
/workspace/data/synthesized_audio/Q448.wav,0.9527311325073242,what is the copyright of d ts playfi
/workspace/data/synthesized_audio/Q240.wav,0.8372611999511719,how to set up support your team
/workspace/data/synthesized_audio/Q326.wav,1.5249567031860352,how can i turn on off the demomi or ambelite demo auto start in retail mode settings
/workspace/data/synthesized_audio/Q171.wav,0.9506640434265137,how do i restore the picture style settings
/workspace/data/synthesized_audio/Q393.wav,0.9610104560852051,what can you tell me about t v self diagnose
/workspace/data/synthesized_audio/Q116.wav,0.8927090167999268,how can i set easy link to sound control
/workspace/data/synthesized_audio/Q247.wav,0.7983744144439697,how do i set up ambysleep audio
/workspace/data/synthesized_audio/Q060.wav,0.9228315353393555,what is the channelist copy feature
/workspace/data/synthesized_audio/Q118.wav,1.01859712600708,what could you tell me about h dmi altrar h d
/workspace/data/synthesized_audio/Q147.wav,1.257263422012329,how can i view photos or play musics and videos from a usb flash drive
/workspace/data/synthesized_audio/Q062.wav,0.9588525295257568,how can i check the current version of the channel list
/workspace/data/synthesized_audio/Q269.wav,1.031877040863037,what to do if google tv is not in the apps row
/workspace/data/synthesized_audio/Q288.wav,1.2651259899139404,are there more accessibility services provided by google
/workspace/data/synthesized_audio/Q383.wav,1.059290885925293,which display input resolutions are supported only
/workspace/data/synthesized_audio/Q285.wav,0.8743529319763184,how can i turn on high contrast text
/workspace/data/synthesized_audio/Q289.wav,0.7973344326019287,how can i update from internet
/workspace/data/synthesized_audio/Q134.wav,1.0198652744293213,how can infix the problem sound with loud noise
/workspace/data/synthesized_audio/Q148.wav,1.6205191612243652,what should i do if usb flash drive or usb hard drive does not appear automatically
/workspace/data/synthesized_audio/Q030.wav,0.8662147521972656,how do i start google assistant
/workspace/data/synthesized_audio/Q165.wav,1.1044807434082031,how to log into tv with email and password
/workspace/data/synthesized_audio/Q233.wav,0.8787801265716553,how do i use digital output leveller
/workspace/data/synthesized_audio/Q417.wav,0.9311623573303223,what can i do if the internet is not working
/workspace/data/synthesized_audio/Q302.wav,0.9403343200683594,how can i set the automatic date and time
/workspace/data/synthesized_audio/Q026.wav,0.6869580745697021,app's internet
/workspace/data/synthesized_audio/Q402.wav,1.000675916671753,what can i do if there's sound but no picture
/workspace/data/synthesized_audio/Q163.wav,1.265106201171875,how to solve the problem of wireless network not found or distorted
/workspace/data/synthesized_audio/Q342.wav,1.0622353553771973,how can i view most popular files or clear the list
/workspace/data/synthesized_audio/Q021.wav,1.25362229347229,how do i return to watching tv or stop and interactive t v application
/workspace/data/synthesized_audio/Q189.wav,0.7334718704223633,how does that color control
/workspace/data/synthesized_audio/Q202.wav,0.8663203716278076,how do i set up speaker virtualizer
/workspace/data/synthesized_audio/Q035.wav,0.7750265598297119,how to select a channel directly
/workspace/data/synthesized_audio/Q024.wav,1.0505735874176025,how do i return to the previously selected channel
/workspace/data/synthesized_audio/Q315.wav,0.896167516708374,how can i set the tv switch off timer
/workspace/data/synthesized_audio/Q277.wav,0.9619240760803223,how can i install a new in google playstore
/workspace/data/synthesized_audio/Q201.wav,0.8658056259155273,how do i restore personal settings
/workspace/data/synthesized_audio/Q069.wav,0.7930562496185303,how can i go to previous channel
/workspace/data/synthesized_audio/Q170.wav,0.7141799926757812,how to set an image style
/workspace/data/synthesized_audio/Q125.wav,1.2146358489990234,what happens if i set optimal auto game xxx h z pro
/workspace/data/synthesized_audio/Q137.wav,0.934765100479126,how can i connect to smartphones and tablets
/workspace/data/synthesized_audio/Q231.wav,0.6857297420501709,how do i set up ea r c
/workspace/data/synthesized_audio/Q380.wav,1.1734895706176758,what are the reception specifications
/workspace/data/synthesized_audio/Q207.wav,0.7958528995513916,how do i set up t v placement
/workspace/data/synthesized_audio/Q053.wav,0.9846041202545166,how can i adjust the volume without the remote
/workspace/data/synthesized_audio/Q212.wav,1.251539945602417,how do i set up playfie speakers as front speakers for my tv
/workspace/data/synthesized_audio/Q155.wav,1.699923038482666,how can i view photos in ultra h d resolution from a connected usb device or flash drive
/workspace/data/synthesized_audio/Q188.wav,0.8097670078277588,how do i set the colour temperature
/workspace/data/synthesized_audio/Q082.wav,0.8738036155700684,how can i set the universal access
/workspace/data/synthesized_audio/Q410.wav,1.194866418838501,what can i do if there's no sound or the sound quality is poor
/workspace/data/synthesized_audio/Q424.wav,1.1665370464324951,how can i change the language back to language in google tv mode
/workspace/data/synthesized_audio/Q376.wav,0.7977311611175537,what is needed to using alexa
/workspace/data/synthesized_audio/Q051.wav,0.8766412734985352,how can i to turn off the tv completely
/workspace/data/synthesized_audio/Q282.wav,0.9638330936431885,how can i start or stop at from homescreen
/workspace/data/synthesized_audio/Q300.wav,1.0142407417297363,how can i view the current tv software version
/workspace/data/synthesized_audio/Q444.wav,0.8017816543579102,what is advanced hevc
/workspace/data/synthesized_audio/Q103.wav,0.6896615028381348,what is search by genre
/workspace/data/synthesized_audio/Q012.wav,1.090174913406372,what is the recommended positioning for tv
/workspace/data/synthesized_audio/Q040.wav,1.0265583992004395,how do i pair the remote control with the tv
/workspace/data/synthesized_audio/Q198.wav,0.7780559062957764,how does that image format
/workspace/data/synthesized_audio/Q377.wav,0.9076263904571533,how do i set up my tv for alexa
/workspace/data/synthesized_audio/Q102.wav,1.28416109085083,how can i view the scheduled programs for the upcoming days and tv guide
/workspace/data/synthesized_audio/Q039.wav,1.598374366760254,how do i launch the edge panel in access settings device controls notifications and more
/workspace/data/synthesized_audio/Q138.wav,0.725792407989502,how can i use blueray disc player
/workspace/data/synthesized_audio/Q031.wav,0.7739748954772949,how do i open the whole menu
/workspace/data/synthesized_audio/Q427.wav,0.9232439994812012,what kind of support and repair options are available
/workspace/data/synthesized_audio/Q001.wav,0.7695536613464355,how do i connect my tv to the internet
/workspace/data/synthesized_audio/Q091.wav,0.8448359966278076,what is a favorite channel
/workspace/data/synthesized_audio/Q006.wav,0.9672436714172363,how do i access the dashboard and settings
/workspace/data/synthesized_audio/Q092.wav,0.9227719306945801,how many favorite channelists can i create
/workspace/data/synthesized_audio/Q407.wav,0.9224753379821777,what can i do if a picture does not fit the screen
/workspace/data/synthesized_audio/Q206.wav,0.8497896194458008,how do i restore personal settings
/workspace/data/synthesized_audio/Q068.wav,0.676530122756958,how can i change channels
/workspace/data/synthesized_audio/Q244.wav,0.8838200569152832,how do i set the duration of ambusleep
/workspace/data/synthesized_audio/Q232.wav,0.8442680835723877,how does that digital output format
/workspace/data/synthesized_audio/Q446.wav,1.1372292041778564,what are the copyrights of dobe vision and dolby atmos
/workspace/data/synthesized_audio/Q323.wav,1.1059684753417969,how can i adjust shop settings in retail mode settings
/workspace/data/synthesized_audio/Q130.wav,0.8945541381835938,what can you tell me about h dmi arc
/workspace/data/synthesized_audio/Q291.wav,1.2959280014038086,what it might be necessary to update the tv software from usb
/workspace/data/synthesized_audio/Q428.wav,1.1244094371795654,how can i find the tv's model number and serial number
/workspace/data/synthesized_audio/Q123.wav,1.5047314167022705,what should i do if the picture or sound is distorted and h dmi ultra h d
/workspace/data/synthesized_audio/Q266.wav,0.8481948375701904,what you can tell me about google tv app
/workspace/data/synthesized_audio/Q239.wav,0.541018009185791,how to track color
/workspace/data/synthesized_audio/Q436.wav,0.805478572845459,what are the risks of hearing damage
/workspace/data/synthesized_audio/Q361.wav,0.7190229892730713,how can i play music
/workspace/data/synthesized_audio/Q238.wav,0.7079746723175049,how do i follow audio
/workspace/data/synthesized_audio/Q294.wav,1.4023585319519043,how can i view the list of software versions that are successfully updated on the tv
/workspace/data/synthesized_audio/Q273.wav,0.8199794292449951,what do i need to use the google play games app
/workspace/data/synthesized_audio/Q194.wav,0.7382967472076416,how do i set up motion styles
/workspace/data/synthesized_audio/Q272.wav,1.1273722648620605,which you can tell me about google play games app
/workspace/data/synthesized_audio/Q406.wav,0.8841385841369629,what can i do if a commercial banner appears
/workspace/data/synthesized_audio/Q101.wav,1.0829856395721436,how can i view program details t v guide program
/workspace/data/synthesized_audio/Q090.wav,0.7740120887756348,how can i switch off channel logos
/workspace/data/synthesized_audio/Q414.wav,0.8944354057312012,what can i do if no volume icon is shown
/workspace/data/synthesized_audio/Q293.wav,0.9777135848999023,how update the tv software automatically
/workspace/data/synthesized_audio/Q261.wav,0.8335874080657959,how to get out of the sunrise alarm
/workspace/data/synthesized_audio/Q283.wav,0.796166181564331,what you can tell me about manage apps
/workspace/data/synthesized_audio/Q379.wav,0.8984565734863281,what is the operating system
/workspace/data/synthesized_audio/Q225.wav,0.8571577072143555,how do i reset everything to default
/workspace/data/synthesized_audio/Q430.wav,0.9345386028289795,what are the risks of electric shock or fire
/workspace/data/synthesized_audio/Q151.wav,1.599205732345581,how can i view photos in ultra h d resolution from a connected usb s storage device
/workspace/data/synthesized_audio/Q113.wav,0.7822482585906982,how can i switch on easy link
/workspace/data/synthesized_audio/Q400.wav,1.3209757804870605,what can i do if previously installed channels are not showing in the channel list
/workspace/data/synthesized_audio/Q278.wav,1.1248793601989746,how can i set parental control in google playstore
/workspace/data/synthesized_audio/Q042.wav,0.7967555522918701,remote control software
/workspace/data/synthesized_audio/Q167.wav,1.0012412071228027,how do i switch to any of the connected devices
/workspace/data/synthesized_audio/Q156.wav,1.039240837097168,how can i have more information on viewing photos
/workspace/data/synthesized_audio/Q162.wav,1.3243381977081299,how do i connect my tv to the internet using a wired connection
/workspace/data/synthesized_audio/Q265.wav,1.092773199081421,how can i install apps from the google play tm store
/workspace/data/synthesized_audio/Q074.wav,0.6567230224609375,suitable for their age
/workspace/data/synthesized_audio/Q335.wav,0.9870274066925049,how can i pairing or pairing again the remote control
/workspace/data/synthesized_audio/Q083.wav,1.3657581806182861,how can i set the universal access for blind or partially cighted people
/workspace/data/synthesized_audio/Q079.wav,0.7055346965789795,what are channel options
/workspace/data/synthesized_audio/Q389.wav,1.2758443355560303,how can i access tv help on a tablet smartphone or computer
/workspace/data/synthesized_audio/Q132.wav,1.2077605724334717,what can i do if the sound does not match the video on screen
/workspace/data/synthesized_audio/Q386.wav,0.759253978729248,what are the multimedia specifications
/workspace/data/synthesized_audio/Q345.wav,1.1867780685424805,what can i do if the list of files does not appear automatically
/workspace/data/synthesized_audio/Q307.wav,1.2592098712921143,how can i change the language of the t v menu and messages
/workspace/data/synthesized_audio/Q037.wav,1.0549027919769287,how do i go to the next or previous channel and the channel list
/workspace/data/synthesized_audio/Q045.wav,1.0211517810821533,how do i replace the batteries in the remote control
/workspace/data/synthesized_audio/Q022.wav,0.7989568710327148,how do i confirm a selection or setting
/workspace/data/synthesized_audio/Q088.wav,0.735870361328125,how can i switch off the jing of thatcher
/workspace/data/synthesized_audio/Q197.wav,0.7889056205749512,how do i set up quick picture settings
/workspace/data/synthesized_audio/Q016.wav,0.9448199272155762,how do i launch the amazon prime video app
/workspace/data/synthesized_audio/Q411.wav,0.9528555870056152,what can you tell me about h d am i troubleshooting
/workspace/data/synthesized_audio/Q263.wav,0.8843040466308594,how to put the tv into standby mode
/workspace/data/synthesized_audio/Q185.wav,0.6963059902191162,how to set the huge setting
/workspace/data/synthesized_audio/Q394.wav,0.8361175060272217,how can i run a self diagnose
/workspace/data/synthesized_audio/Q312.wav,0.804689884185791,how can i set the energy saver
/workspace/data/synthesized_audio/Q275.wav,0.9228527545928955,how can i start or stop a google play game
/workspace/data/synthesized_audio/Q027.wav,0.9225389957427979,how do i open or close the option's menu
/workspace/data/synthesized_audio/Q075.wav,0.6719803810119629,how can i set an age rating
/workspace/data/synthesized_audio/Q242.wav,0.7003617286682129,how do i set custom color
/workspace/data/synthesized_audio/Q135.wav,1.349461317062378,what can i do if i cannot hear the sound from the tv on home feather system
/workspace/data/synthesized_audio/Q434.wav,0.7132046222686768,what is the risk of overheating
/workspace/data/synthesized_audio/Q271.wav,0.9266927242279053,what do i need to use the youtube music app
/workspace/data/synthesized_audio/Q131.wav,0.8966341018676758,what can you tell me about h dmi earc
/workspace/data/synthesized_audio/Q343.wav,0.8090589046478271,how can i view last played files
/workspace/data/synthesized_audio/Q439.wav,0.7739145755767822,how to care for the screen
/workspace/data/synthesized_audio/Q333.wav,0.9224634170532227,how can i remove bluetooth registered device
/workspace/data/synthesized_audio/Q100.wav,0.8774838447570801,tell me what is tv guide data
/workspace/data/synthesized_audio/Q018.wav,0.6849696636199951,how do i open the youtube ap
/workspace/data/synthesized_audio/Q358.wav,1.4604568481445312,can you show me the control bar to view three hundred sixty photos
/workspace/data/synthesized_audio/Q280.wav,1.031937837600708,how can i make a payment on google play on tv
/workspace/data/synthesized_audio/Q174.wav,0.7835302352905273,how to set ambient light level
/workspace/data/synthesized_audio/Q050.wav,0.7532868385314941,what's happened in standby mode
/workspace/data/synthesized_audio/Q179.wav,0.7031090259552002,how to set black level
/workspace/data/synthesized_audio/Q367.wav,1.2448840141296387,how many game pads can be connected to the t v simultaneously
/workspace/data/synthesized_audio/Q105.wav,0.7980484962463379,what can you tell me about connections
/workspace/data/synthesized_audio/Q058.wav,1.4380364418029785,what should i do if the t v asks for a pin code during the manual channel update
/workspace/data/synthesized_audio/Q384.wav,0.9060938358306885,what are the connectivity specifications
/workspace/data/synthesized_audio/Q154.wav,1.3559627532958984,what should i do if content list does not appear automatically on the camera
/workspace/data/synthesized_audio/Q234.wav,0.8896586894989014,how do i set the digital output delay
/workspace/data/synthesized_audio/Q331.wav,1.0219051837921143,how can i rename a bluetooth registered device
/workspace/data/synthesized_audio/Q350.wav,0.9097847938537598,what can you tell me about playing video philus
/workspace/data/synthesized_audio/Q048.wav,0.8580079078674316,how can i reboot my tv
/workspace/data/synthesized_audio/Q391.wav,0.7855842113494873,what can you tell me about tv diagnosis
/workspace/data/synthesized_audio/Q145.wav,1.0102794170379639,what can you tell me about special keys for entering text
/workspace/data/synthesized_audio/Q433.wav,0.6953928470611572,what are the risks of batteries
/workspace/data/synthesized_audio/Q065.wav,1.1333880424499512,how to upload channellist to a not installed tvs
/workspace/data/synthesized_audio/Q176.wav,0.7846205234527588,how do i set contrast modes
/workspace/data/synthesized_audio/Q355.wav,0.846411943435669,what can you tell me about playing photophiles
/workspace/data/synthesized_audio/Q141.wav,1.0033738613128662,how can i have a better quality in game consoles
/workspace/data/synthesized_audio/Q055.wav,1.1032133102416992,how can i access the sources without the remote control
/workspace/data/synthesized_audio/Q382.wav,1.2550363540649414,what screen input resolutions are supported by computer video
/workspace/data/synthesized_audio/Q327.wav,0.7504110336303711,how can i restart the tv
/workspace/data/synthesized_audio/Q193.wav,0.9835171699523926,how do i set up mpeg artifact reduction
/workspace/data/synthesized_audio/Q422.wav,1.2721450328826904,what can i do if the bluetooth registered connection is lost
/workspace/data/synthesized_audio/Q432.wav,0.7987189292907715,what are the stability hazards
/workspace/data/synthesized_audio/Q112.wav,1.0615544319152832,what can you tell me about h dmi c c eselink
/workspace/data/synthesized_audio/Q332.wav,0.9505338668823242,is there another way to disconnect bluetooth
/workspace/data/synthesized_audio/Q143.wav,0.7170190811157227,how can i install the keyboard
/workspace/data/synthesized_audio/Q218.wav,0.7776107788085938,how do i adjust the bass level
/workspace/data/synthesized_audio/Q399.wav,1.268357515335083,what can i do if no digital channels are found during installation
/workspace/data/synthesized_audio/Q104.wav,0.9340171813964844,how can i search by genre and tv guide
/workspace/data/synthesized_audio/Q369.wav,1.292618989944458,how do i turn the game control bar on and off in game mode or monitor mode
/workspace/data/synthesized_audio/Q260.wav,1.0915718078613281,how do i access the sunrise alarm setting's menu
/workspace/data/synthesized_audio/Q085.wav,1.0174174308776855,how can i switch audio effects an audio description
/workspace/data/synthesized_audio/Q157.wav,0.8464362621307373,how can i have a best quality in camcorder
/workspace/data/synthesized_audio/Q392.wav,0.9787249565124512,how can i run a tv diagnosis test
/workspace/data/synthesized_audio/Q321.wav,1.3260879516601562,how can i set the lock to block the rated programs in childlock
/workspace/data/synthesized_audio/Q357.wav,0.8853871822357178,how can i view in three hundred sixty photos
/workspace/data/synthesized_audio/Q034.wav,0.751840353012085,how to adjust the volume level
